[
  {
    "primary": [
      {
        "dimension": "crit_rate",
        "bucket": "FLAT",
        "value": 0.2,
        "system": "items"
      }
    ],
    "derived": [],
    "caps": [
      {
        "system": "world",
        "dimension": "crit_rate",
        "mode": "OVERRIDE",
        "kind": "max",
        "value": 0.25,
        "scope": "WORLD",
        "priority": 10
      },
      {
        "system": "items",
        "dimension": "crit_rate",
        "mode": "ADDITIVE",
        "kind": "max",
        "value": 0.8,
        "scope": "TOTAL"
      }
    ],
    "meta": {
      "system": "items"
    }
  }
]